<?xml version="1.0" encoding="UTF-8"?>
<!DOCTYPE lovs SYSTEM "lovs.dtd">

<lovs>
	<lov code="months" description="All months">
		<field value="0" key="month.0" />
		<field value="1" key="month.1" />
		<field value="2" key="month.2" />
		<field value="3" key="month.3" />
		<field value="4" key="month.4" />
		<field value="5" key="month.5" />
		<field value="6" key="month.6" />
		<field value="7" key="month.7" />
		<field value="8" key="month.8" />
		<field value="9" key="month.9" />
		<field value="10" key="month.10" />
		<field value="11" key="month.11" />
	</lov>
</lovs>
